{
 "apricity_manifest": 1,
 "source": {
  "path": "St-Patricks-parade_144941_003_00-02-57.wav",
  "sha256": "6e35e1ae85f78061b4a2e5dd8b57ce0046433482f2984586d7648ed839ddcb24",
  "sample_rate": 48000,
  "channels": 2,
  "duration": 6.641
 },
 "analysis": {
  "analyzed_at": "2026-09-23T23:24:10+00:00",
  "tools": {
   "apricity-analyze": "0.2.0",
   "essentia": "2.1b6.dev1389",
   "beat_this": "final0",
   "librosa": "1.0.0 (HPSS margin 2.0 before chroma)"
  }
 },
 "rhythm": {
  "bpm": 120.0,
  "bpm_stability": 0.972,
  "beats": [
   0.02,
   0.52,
   1.02,
   1.5,
   2.02,
   2.54,
   3.04,
   3.54,
   4.06,
   4.54,
   5.06,
   5.58,
   6.08,
   6.58
  ],
  "downbeats": [
   0.02,
   1.5,
   3.04,
   4.54,
   6.08
  ],
  "meter": 3,
  "warp_markers": [
   {
    "seconds": 0.02,
    "beat": 0.0
   },
   {
    "seconds": 0.52,
    "beat": 1.0
   },
   {
    "seconds": 1.02,
    "beat": 2.0
   },
   {
    "seconds": 1.5,
    "beat": 3.0
   },
   {
    "seconds": 2.02,
    "beat": 4.0
   },
   {
    "seconds": 2.54,
    "beat": 5.0
   },
   {
    "seconds": 3.04,
    "beat": 6.0
   },
   {
    "seconds": 3.54,
    "beat": 7.0
   },
   {
    "seconds": 4.06,
    "beat": 8.0
   },
   {
    "seconds": 4.54,
    "beat": 9.0
   },
   {
    "seconds": 5.06,
    "beat": 10.0
   },
   {
    "seconds": 5.58,
    "beat": 11.0
   },
   {
    "seconds": 6.08,
    "beat": 12.0
   },
   {
    "seconds": 6.58,
    "beat": 13.0
   }
  ],
  "beat_loudness": [
   -18.5,
   -21.7,
   -20.8,
   -23.2,
   -18.8,
   -20.4,
   -23.2,
   -22.8,
   -17.8,
   -17.7,
   -17.2,
   -23.3,
   -17.7
  ]
 },
 "tonal": {
  "key": {
   "tonic": "A",
   "mode": "major",
   "strength": 0.7932,
   "camelot": "11B",
   "profile": "temperley"
  },
  "alternatives": [
   {
    "tonic": "E",
    "mode": "major",
    "strength": 0.6533,
    "camelot": "12B",
    "profile": "temperley"
   },
   {
    "tonic": "B",
    "mode": "minor",
    "strength": 0.6427,
    "camelot": "10A",
    "profile": "temperley"
   },
   {
    "tonic": "B",
    "mode": "major",
    "strength": 0.5969,
    "camelot": "1B",
    "profile": "temperley"
   }
  ],
  "tuning_hz": 448.73,
  "tuning_cents": 34.0,
  "pitch_class_profile": [
   0.3297,
   0.9378,
   0.6513,
   0.5481,
   1.0,
   0.3932,
   0.8168,
   0.2987,
   0.4363,
   0.6211,
   0.4327,
   0.861
  ],
  "segments": [
   {
    "start": 0.0,
    "end": 6.641,
    "key": {
     "tonic": "A",
     "mode": "major",
     "strength": 0.795,
     "camelot": "11B",
     "profile": "temperley"
    },
    "pitch_class_profile": [
     0.3298,
     0.9372,
     0.6498,
     0.5479,
     1.0,
     0.3799,
     0.817,
     0.2979,
     0.4365,
     0.6214,
     0.4288,
     0.8612
    ]
   }
  ],
  "beat_chroma": [
   [
    0.3052,
    0.6378,
    0.152,
    0.3751,
    0.7507,
    0.3078,
    0.6737,
    0.1937,
    0.3703,
    0.2382,
    0.0781,
    1.0
   ],
   [
    0.2849,
    0.2038,
    0.2039,
    0.5794,
    0.9347,
    0.2841,
    0.1909,
    0.174,
    0.2914,
    0.6285,
    0.328,
    1.0
   ],
   [
    0.2293,
    0.4119,
    0.2874,
    0.4349,
    1.0,
    0.2876,
    0.4926,
    0.1699,
    0.2811,
    0.9016,
    0.3212,
    0.9445
   ],
   [
    0.0755,
    0.6624,
    0.3687,
    0.3774,
    0.2949,
    0.1858,
    1.0,
    0.1736,
    0.1533,
    0.1306,
    0.6486,
    0.5738
   ],
   [
    0.1447,
    1.0,
    0.1486,
    0.3923,
    0.7362,
    0.1474,
    0.9191,
    0.1682,
    0.3998,
    0.2403,
    0.6291,
    0.4494
   ],
   [
    0.1058,
    0.8671,
    0.1669,
    0.1619,
    0.7736,
    0.2227,
    1.0,
    0.0664,
    0.157,
    0.309,
    0.3184,
    0.4659
   ],
   [
    0.3576,
    0.5944,
    0.7046,
    0.3662,
    1.0,
    0.425,
    0.9816,
    0.267,
    0.1741,
    0.8651,
    0.3573,
    0.9625
   ],
   [
    0.0748,
    0.2901,
    1.0,
    0.2465,
    0.272,
    0.1709,
    0.1751,
    0.3513,
    0.095,
    0.545,
    0.1547,
    0.246
   ],
   [
    0.4135,
    0.6118,
    0.9076,
    0.8897,
    1.0,
    0.198,
    0.5696,
    0.2733,
    0.2706,
    0.8294,
    0.3714,
    0.8003
   ],
   [
    0.2069,
    1.0,
    0.6,
    0.4846,
    0.3513,
    0.4312,
    0.5427,
    0.2423,
    0.2488,
    0.2779,
    0.1702,
    0.1561
   ],
   [
    0.3772,
    0.4775,
    0.6298,
    0.4754,
    1.0,
    0.3189,
    0.1546,
    0.2299,
    0.3875,
    0.4384,
    0.1287,
    0.1993
   ],
   [
    0.2305,
    1.0,
    0.2784,
    0.1475,
    0.2281,
    0.1255,
    0.2424,
    0.1236,
    0.4827,
    0.165,
    0.1569,
    0.2106
   ],
   [
    0.2709,
    0.6621,
    0.4218,
    0.2465,
    1.0,
    0.3586,
    0.4817,
    0.2345,
    0.5997,
    0.2873,
    0.2206,
    0.9788
   ]
  ]
 },
 "notes": [
  {
   "start": 0.2322,
   "end": 0.3715,
   "midi": 40,
   "velocity": 0.453
  },
  {
   "start": 0.4992,
   "end": 0.7546,
   "midi": 45,
   "velocity": 0.298
  },
  {
   "start": 0.6269,
   "end": 0.7895,
   "midi": 39,
   "velocity": 0.406
  },
  {
   "start": 0.7779,
   "end": 0.9404,
   "midi": 57,
   "velocity": 0.288
  },
  {
   "start": 1.5906,
   "end": 1.7531,
   "midi": 54,
   "velocity": 0.378
  },
  {
   "start": 1.9273,
   "end": 2.0562,
   "midi": 54,
   "velocity": 0.31
  },
  {
   "start": 2.0679,
   "end": 2.4045,
   "midi": 40,
   "velocity": 0.375
  },
  {
   "start": 2.2768,
   "end": 2.4162,
   "midi": 54,
   "velocity": 0.415
  },
  {
   "start": 2.4045,
   "end": 2.6019,
   "midi": 40,
   "velocity": 0.499
  },
  {
   "start": 2.66,
   "end": 2.8922,
   "midi": 54,
   "velocity": 0.345
  },
  {
   "start": 2.8922,
   "end": 3.0431,
   "midi": 54,
   "velocity": 0.411
  },
  {
   "start": 3.8094,
   "end": 3.9487,
   "midi": 57,
   "velocity": 0.282
  },
  {
   "start": 4.5653,
   "end": 4.7278,
   "midi": 42,
   "velocity": 0.434
  },
  {
   "start": 4.7278,
   "end": 4.8904,
   "midi": 42,
   "velocity": 0.523
  },
  {
   "start": 4.8323,
   "end": 5.0065,
   "midi": 61,
   "velocity": 0.333
  },
  {
   "start": 5.0529,
   "end": 5.2387,
   "midi": 64,
   "velocity": 0.266
  },
  {
   "start": 5.2038,
   "end": 5.4128,
   "midi": 40,
   "velocity": 0.318
  },
  {
   "start": 5.6102,
   "end": 5.9004,
   "midi": 61,
   "velocity": 0.469
  },
  {
   "start": 6.0526,
   "end": 6.2732,
   "midi": 40,
   "velocity": 0.565
  },
  {
   "start": 6.0875,
   "end": 6.2268,
   "midi": 68,
   "velocity": 0.275
  }
 ],
 "annotations": {
  "slices": [
   {
    "name": "hit-1",
    "start": 0.02,
    "end": 0.52,
    "source": "ml",
    "tags": [
     "hit"
    ]
   },
   {
    "name": "hit-2",
    "start": 6.08,
    "end": 6.58,
    "source": "ml",
    "tags": [
     "hit"
    ]
   }
  ],
  "markers": [
   {
    "name": "hit",
    "seconds": 0.02,
    "source": "ml"
   },
   {
    "name": "hit",
    "seconds": 6.08,
    "source": "ml"
   }
  ]
 }
}
